{
  "protocol_id": "RELEASE_A_AG_RECONSTRUCTION_PROTOCOL_v1.0",
  "protocol_sha256": "5fba335b37459d0b474f9b868d14275f8bf62372332aba2d6cb1a9b565aebb76",
  "status": "FROZEN_v1.0",
  "study_id": "RELEASE_A_AG_RECONSTRUCTION_PACKET_v1.0",
  "census_registered_at": "2026-09-26T18:00:00Z",
  "a8_package_id": "RELEASE_A_A8_PRODUCT_POPULATION_RELEASE_PACKAGE_v1.0",
  "a8_package_sha256": "71ff7a917e9104ca279352643afbaebabc19c362527d36bcbfab1311aef73190",
  "a8_contract_sha256": "f5acad2896c767b80bd75a951ea933cc1d2c319a9580aa560e46db46e824cf78",
  "analysis_universe_id": "RAU-feb22ac8e7bc2f9ee644ecc2682e974eb73a40bfc5dccfc2ce2f3ee37abd774e",
  "world_time_cutoff": "2026-09-24",
  "knowledge_time_cutoff": "2026-10-24T23:59:59Z",
  "language_scope_id": "EN_PLUS_PRIORITY_NATIVE_v1",
  "jurisdiction_scope": "GLOBAL_PROTOCOL_SCOPE",
  "population_view_id": "A-P1",
  "n_observed_declared": 6,
  "n_estimated_declared": null,
  "unresolved_candidate_count_declared": 416,
  "d4_working_include_declared": 49,
  "d4_working_total_declared": 60,
  "observed_offering_ids": [
    "PRD-EMOTIV-EPOC-X",
    "PRD-FLOW-FL-100",
    "PRD-MODIUS-SPERO",
    "PRD-MUSE-S-ATHENA",
    "PRD-NEXTSENSE-SMARTBUDS",
    "PRD-SYNCHRON-STENTRODE"
  ],
  "required_reconstruction_fields": [
    "counted_object",
    "exact_identity",
    "source_observations",
    "source_frames",
    "language_jurisdiction_scope",
    "world_knowledge_cutoffs",
    "discovery_stopping_rule",
    "observed_vs_estimated",
    "model_assumptions",
    "uncertainty",
    "unresolved_evidence",
    "publication_authority"
  ],
  "required_headline_ids": [
    "N_OBSERVED_A_P1",
    "N_ESTIMATED_A_P1",
    "DELTA_N_CAPABILITY",
    "DELTA_N_MULTILINGUAL",
    "D4_WORKING_INCLUDE",
    "UNRESOLVED_CANDIDATES_RETAINED",
    "FRAME_STOP_STATE_A6"
  ],
  "headline_reconstruction_bindings": {
    "N_OBSERVED_A_P1": {
      "a8_component_path": "components.product_registry",
      "upstream_digest_field": "product_registry_sha256",
      "expected_value_description": "N_observed=6 distinct A-P1 PRODUCT/OFFERING identities",
      "required_fields": [
        "counted_object",
        "exact_identity",
        "source_observations",
        "source_frames",
        "language_jurisdiction_scope",
        "world_knowledge_cutoffs",
        "discovery_stopping_rule",
        "observed_vs_estimated",
        "model_assumptions",
        "uncertainty",
        "unresolved_evidence",
        "publication_authority"
      ]
    },
    "N_ESTIMATED_A_P1": {
      "a8_component_path": "components.a7_population_estimation_report",
      "upstream_digest_field": "a7_estimation_report_sha256",
      "expected_value_description": "N_estimated=null under A7 FAIL_CLOSED",
      "required_fields": [
        "counted_object",
        "exact_identity",
        "source_observations",
        "source_frames",
        "language_jurisdiction_scope",
        "world_knowledge_cutoffs",
        "discovery_stopping_rule",
        "observed_vs_estimated",
        "model_assumptions",
        "uncertainty",
        "unresolved_evidence",
        "publication_authority"
      ]
    },
    "DELTA_N_CAPABILITY": {
      "a8_component_path": "components.a3_capability_first_recall_study",
      "upstream_digest_field": "a3_study_sha256",
      "expected_value_description": "delta_n_capability=0 under A-P1",
      "required_fields": [
        "counted_object",
        "exact_identity",
        "source_observations",
        "source_frames",
        "language_jurisdiction_scope",
        "world_knowledge_cutoffs",
        "discovery_stopping_rule",
        "observed_vs_estimated",
        "model_assumptions",
        "uncertainty",
        "unresolved_evidence",
        "publication_authority"
      ]
    },
    "DELTA_N_MULTILINGUAL": {
      "a8_component_path": "components.a4_multilingual_coverage_sensitivity_report",
      "upstream_digest_field": "a4_study_sha256",
      "expected_value_description": "delta_n_multilingual=0 under A-P1 / EN_PLUS_PRIORITY_NATIVE_v1",
      "required_fields": [
        "counted_object",
        "exact_identity",
        "source_observations",
        "source_frames",
        "language_jurisdiction_scope",
        "world_knowledge_cutoffs",
        "discovery_stopping_rule",
        "observed_vs_estimated",
        "model_assumptions",
        "uncertainty",
        "unresolved_evidence",
        "publication_authority"
      ]
    },
    "D4_WORKING_INCLUDE": {
      "a8_component_path": "components.d4_reference_standard_summary",
      "upstream_digest_field": "d4_reference_standard_version",
      "expected_value_description": "D4 INCLUDE 49 of TOTAL 60 working-reference cases",
      "required_fields": [
        "counted_object",
        "exact_identity",
        "source_observations",
        "source_frames",
        "language_jurisdiction_scope",
        "world_knowledge_cutoffs",
        "discovery_stopping_rule",
        "observed_vs_estimated",
        "model_assumptions",
        "uncertainty",
        "unresolved_evidence",
        "publication_authority"
      ]
    },
    "UNRESOLVED_CANDIDATES_RETAINED": {
      "a8_component_path": "components.explicit_unknown_unresolved_register",
      "upstream_digest_field": "a2_checkpoint_sha256",
      "expected_value_description": "416 unresolved candidates retained (not products)",
      "required_fields": [
        "counted_object",
        "exact_identity",
        "source_observations",
        "source_frames",
        "language_jurisdiction_scope",
        "world_knowledge_cutoffs",
        "discovery_stopping_rule",
        "observed_vs_estimated",
        "model_assumptions",
        "uncertainty",
        "unresolved_evidence",
        "publication_authority"
      ]
    },
    "FRAME_STOP_STATE_A6": {
      "a8_component_path": "components.a6_coverage_saturation_report",
      "upstream_digest_field": "a6_study_sha256",
      "expected_value_description": "A6 final_stop_state=SATURATION_UNDER_DECLARED_PROTOCOL (not census)",
      "required_fields": [
        "counted_object",
        "exact_identity",
        "source_observations",
        "source_frames",
        "language_jurisdiction_scope",
        "world_knowledge_cutoffs",
        "discovery_stopping_rule",
        "observed_vs_estimated",
        "model_assumptions",
        "uncertainty",
        "unresolved_evidence",
        "publication_authority"
      ]
    }
  },
  "fail_closed_rules": {
    "missing_upstream_digest_is_unpassed": true,
    "invented_n_estimated_is_rejected": true,
    "completeness_overclaim_is_rejected": true,
    "mixed_universe_is_rejected": true,
    "estimator_contamination_f7_f9_f11_is_rejected": true,
    "unresolved_required_field_is_unpassed": true
  },
  "estimator_exclusion_policy": {
    "excluded_frame_ids": [
      "F7",
      "F9",
      "F11"
    ],
    "reject_primary_estimator_contamination": true
  },
  "execution_gate": {
    "requires_frozen_protocol_before_packet": true,
    "freeze_alone_does_not_emit_outcome": true,
    "does_not_authorize_release_b_c_d": true,
    "does_not_establish_s2_publication_authority": true,
    "does_not_create_v4_2_assessment_effect": true,
    "does_not_mutate_rau": true,
    "does_not_allocate_canonical_identity": true,
    "does_not_reopen_closed_discovery_fitting": true,
    "preserves_a7_fail_closed": true,
    "f9_exhaustion_is_not_global_completeness": true,
    "open_world_saturation_is_not_census": true,
    "reconstruction_not_paperwork_signoff": true
  },
  "predeclaration_rule": "Bind the exact A8 package digest and the twelve reconstruction fields for each required headline before emitting any A-G reconstruction packet. Freeze alone does not emit PASSED/UNPASSED and does not authorize Release B/C/D.",
  "boundary": "A-G reconstruction protocol freezes the Release-A reconstruction checklist and binds the exact A8 Product Population Release Package digest before any reconstruction packet is emitted. It requires reconstructability of the twelve declared fields for each required headline from immutable artifacts. Freeze alone does not emit a PASSED or UNPASSED A-G outcome, authorize Release B/C/D, establish S2 publication authority, or create v4.2 assessment effect. A7 fail-closed N_observed=6 with no N_estimated is preserved. F9 exhaustion is not global completeness; open-world saturation is not a census."
}
